{
  "schemaVersion": "1.0.0",
  "caseId": "wellforge-mock-case",
  "createdAt": "2026-08-27T00:00:00.000Z",
  "producer": {
    "name": "WellForge",
    "version": "1.0.0"
  },
  "metadata": {
    "well": "MOCK HAWK RIDGE 7H",
    "field": "DEMO PAD WEST",
    "pad": "DEMO PAD WEST",
    "rig": "RIG SIM-7",
    "datum": "RKB",
    "northReference": "Grid North",
    "surfaceNorth": {
      "value": 0,
      "unit": "ft"
    },
    "surfaceEast": {
      "value": 0,
      "unit": "ft"
    },
    "groundElevation": {
      "value": 5000,
      "unit": "ft"
    },
    "verticalSectionAzimuth": {
      "value": 55,
      "unit": "deg"
    }
  },
  "unitPreferences": {
    "length": "ft",
    "diameter": "in",
    "density": "ppg",
    "force": "klbf",
    "pressure": "psi",
    "torque": "ft-lbf",
    "angle": "deg",
    "flowRate": "gpm",
    "viscosity": "cP"
  },
  "trajectory": {
    "plan": [
      {
        "id": "plan-000",
        "station": 0,
        "md": {
          "value": 0,
          "unit": "ft"
        },
        "inclination": {
          "value": 0,
          "unit": "deg"
        },
        "azimuth": {
          "value": 20,
          "unit": "deg"
        },
        "source": "Directional reference plan"
      },
      {
        "id": "plan-001",
        "station": 1,
        "md": {
          "value": 500,
          "unit": "ft"
        },
        "inclination": {
          "value": 0,
          "unit": "deg"
        },
        "azimuth": {
          "value": 20,
          "unit": "deg"
        },
        "source": "Directional reference plan"
      },
      {
        "id": "plan-002",
        "station": 2,
        "md": {
          "value": 1000,
          "unit": "ft"
        },
        "inclination": {
          "value": 0,
          "unit": "deg"
        },
        "azimuth": {
          "value": 20,
          "unit": "deg"
        },
        "source": "Directional reference plan"
      },
      {
        "id": "plan-003",
        "station": 3,
        "md": {
          "value": 1500,
          "unit": "ft"
        },
        "inclination": {
          "value": 0,
          "unit": "deg"
        },
        "azimuth": {
          "value": 20,
          "unit": "deg"
        },
        "source": "Directional reference plan"
      },
      {
        "id": "plan-004",
        "station": 4,
        "md": {
          "value": 2000,
          "unit": "ft"
        },
        "inclination": {
          "value": 0,
          "unit": "deg"
        },
        "azimuth": {
          "value": 20,
          "unit": "deg"
        },
        "source": "Directional reference plan"
      },
      {
        "id": "plan-005",
        "station": 5,
        "md": {
          "value": 2500,
          "unit": "ft"
        },
        "inclination": {
          "value": 0,
          "unit": "deg"
        },
        "azimuth": {
          "value": 20,
          "unit": "deg"
        },
        "source": "Directional reference plan"
      },
      {
        "id": "plan-006",
        "station": 6,
        "md": {
          "value": 3000,
          "unit": "ft"
        },
        "inclination": {
          "value": 0,
          "unit": "deg"
        },
        "azimuth": {
          "value": 20,
          "unit": "deg"
        },
        "source": "Directional reference plan"
      },
      {
        "id": "plan-007",
        "station": 7,
        "md": {
          "value": 3500,
          "unit": "ft"
        },
        "inclination": {
          "value": 0,
          "unit": "deg"
        },
        "azimuth": {
          "value": 20,
          "unit": "deg"
        },
        "source": "Directional reference plan"
      },
      {
        "id": "plan-008",
        "station": 8,
        "md": {
          "value": 4000,
          "unit": "ft"
        },
        "inclination": {
          "value": 0,
          "unit": "deg"
        },
        "azimuth": {
          "value": 20,
          "unit": "deg"
        },
        "source": "Directional reference plan"
      },
      {
        "id": "plan-009",
        "station": 9,
        "md": {
          "value": 4500,
          "unit": "ft"
        },
        "inclination": {
          "value": 0,
          "unit": "deg"
        },
        "azimuth": {
          "value": 20,
          "unit": "deg"
        },
        "source": "Directional reference plan"
      },
      {
        "id": "plan-010",
        "station": 10,
        "md": {
          "value": 5000,
          "unit": "ft"
        },
        "inclination": {
          "value": 0,
          "unit": "deg"
        },
        "azimuth": {
          "value": 20,
          "unit": "deg"
        },
        "source": "Directional reference plan"
      },
      {
        "id": "plan-011",
        "station": 11,
        "md": {
          "value": 5125,
          "unit": "ft"
        },
        "inclination": {
          "value": 10,
          "unit": "deg"
        },
        "azimuth": {
          "value": 22.222,
          "unit": "deg"
        },
        "source": "Directional reference plan"
      },
      {
        "id": "plan-012",
        "station": 12,
        "md": {
          "value": 5250,
          "unit": "ft"
        },
        "inclination": {
          "value": 20,
          "unit": "deg"
        },
        "azimuth": {
          "value": 24.444,
          "unit": "deg"
        },
        "source": "Directional reference plan"
      },
      {
        "id": "plan-013",
        "station": 13,
        "md": {
          "value": 5375,
          "unit": "ft"
        },
        "inclination": {
          "value": 30,
          "unit": "deg"
        },
        "azimuth": {
          "value": 26.667,
          "unit": "deg"
        },
        "source": "Directional reference plan"
      },
      {
        "id": "plan-014",
        "station": 14,
        "md": {
          "value": 5500,
          "unit": "ft"
        },
        "inclination": {
          "value": 40,
          "unit": "deg"
        },
        "azimuth": {
          "value": 28.889,
          "unit": "deg"
        },
        "source": "Directional reference plan"
      },
      {
        "id": "plan-015",
        "station": 15,
        "md": {
          "value": 5625,
          "unit": "ft"
        },
        "inclination": {
          "value": 50,
          "unit": "deg"
        },
        "azimuth": {
          "value": 31.111,
          "unit": "deg"
        },
        "source": "Directional reference plan"
      },
      {
        "id": "plan-016",
        "station": 16,
        "md": {
          "value": 5750,
          "unit": "ft"
        },
        "inclination": {
          "value": 60,
          "unit": "deg"
        },
        "azimuth": {
          "value": 33.333,
          "unit": "deg"
        },
        "source": "Directional reference plan"
      },
      {
        "id": "plan-017",
        "station": 17,
        "md": {
          "value": 5875,
          "unit": "ft"
        },
        "inclination": {
          "value": 70,
          "unit": "deg"
        },
        "azimuth": {
          "value": 35.556,
          "unit": "deg"
        },
        "source": "Directional reference plan"
      },
      {
        "id": "plan-018",
        "station": 18,
        "md": {
          "value": 6000,
          "unit": "ft"
        },
        "inclination": {
          "value": 80,
          "unit": "deg"
        },
        "azimuth": {
          "value": 37.778,
          "unit": "deg"
        },
        "source": "Directional reference plan"
      },
      {
        "id": "plan-019",
        "station": 19,
        "md": {
          "value": 6125,
          "unit": "ft"
        },
        "inclination": {
          "value": 90,
          "unit": "deg"
        },
        "azimuth": {
          "value": 40,
          "unit": "deg"
        },
        "source": "Directional reference plan"
      },
      {
        "id": "plan-020",
        "station": 20,
        "md": {
          "value": 6375,
          "unit": "ft"
        },
        "inclination": {
          "value": 90.021,
          "unit": "deg"
        },
        "azimuth": {
          "value": 41.657,
          "unit": "deg"
        },
        "source": "Directional reference plan"
      },
      {
        "id": "plan-021",
        "station": 21,
        "md": {
          "value": 6625,
          "unit": "ft"
        },
        "inclination": {
          "value": 90.072,
          "unit": "deg"
        },
        "azimuth": {
          "value": 43.295,
          "unit": "deg"
        },
        "source": "Directional reference plan"
      },
      {
        "id": "plan-022",
        "station": 22,
        "md": {
          "value": 6875,
          "unit": "ft"
        },
        "inclination": {
          "value": 90.173,
          "unit": "deg"
        },
        "azimuth": {
          "value": 44.895,
          "unit": "deg"
        },
        "source": "Directional reference plan"
      },
      {
        "id": "plan-023",
        "station": 23,
        "md": {
          "value": 7125,
          "unit": "ft"
        },
        "inclination": {
          "value": 90.324,
          "unit": "deg"
        },
        "azimuth": {
          "value": 46.439,
          "unit": "deg"
        },
        "source": "Directional reference plan"
      },
      {
        "id": "plan-024",
        "station": 24,
        "md": {
          "value": 7375,
          "unit": "ft"
        },
        "inclination": {
          "value": 90.505,
          "unit": "deg"
        },
        "azimuth": {
          "value": 47.911,
          "unit": "deg"
        },
        "source": "Directional reference plan"
      },
      {
        "id": "plan-025",
        "station": 25,
        "md": {
          "value": 7625,
          "unit": "ft"
        },
        "inclination": {
          "value": 90.681,
          "unit": "deg"
        },
        "azimuth": {
          "value": 49.295,
          "unit": "deg"